method,score,hypothesis_id,hypothesis_confidence,hypothesis_text,class_match,hypothesis_explanation
org.apache.commons.lang.ClassUtils.getShortClassName(Class),0.900000,H5,0.700000,"Hypothesis H5: The failure might be caused by a recent change in the method handling null inputs, leading to an unexpected null pointer exception when the test case does not account for null class objects.",org.apache.commons.lang.ClassUtils (HH1),"The method `org.apache.commons.lang.ClassUtils.getShortClassName(Class)` does not support Hypothesis H5, as it explicitly handles null inputs by returning an empty string when the input class is null. This is evident from the code snippet where it checks `if (cls == null)` and returns `StringUtils.EMPTY`, thus preventing a null pointer exception. The failure in the test case is related to the handling of array class names, not null inputs."
org.apache.commons.lang.ClassUtils.getShortClassName(String),0.800000,H1,0.700000,"Hypothesis H1: The failure may be caused by recent changes in the `ClassUtils` class that altered the behavior of the `getShortClassName` method, leading to unexpected results in the test.",org.apache.commons.lang.ClassUtils (HH1),"The method `org.apache.commons.lang.ClassUtils.getShortClassName(String)` is designed to extract the class name without the package name from a given string, assuming the input is a valid class name. The failure in the test case, specifically with the array class `String[].class`, suggests that the method might not be handling array class names correctly, as indicated by the unexpected output ""String[;]"" instead of ""String[]"". This discrepancy supports Hypothesis H1, as it implies that recent changes in the `ClassUtils` class may have altered how array class names are processed, leading to the observed test failure."
"org.apache.commons.lang.ClassUtils.addAbbreviation(String,String)",0.200000,H2,0.700000,"Hypothesis H2: The failure may be caused by a recent change in the method handling null or primitive class types, leading to incorrect short class name generation.",org.apache.commons.lang.ClassUtils (HH1),"The method `org.apache.commons.lang.ClassUtils.addAbbreviation(String,String)` is unrelated to handling null or primitive class types directly, as it focuses on mapping primitive type names to their abbreviations. It does not interact with the logic for generating short class names, nor does it handle null values. Therefore, it neither supports nor contradicts Hypothesis H2, as the failure in generating the short class name for arrays (e.g., ""String[]"") is unrelated to the abbreviation mappings managed by this method."
org.apache.commons.lang.ClassUtils.getPackageName(Class),0.200000,H2,0.700000,"Hypothesis H2: The failure may be caused by a recent change in the method handling null or primitive class types, leading to incorrect short class name generation.",org.apache.commons.lang.ClassUtils (HH1),"The method `org.apache.commons.lang.ClassUtils.getPackageName(Class)` does not directly support or contradict Hypothesis H2, as it primarily deals with extracting the package name from a class and handles `null` by returning an empty string. The failure in the test `test_getShortClassName_Class` is related to the handling of array class names, not null or primitive types, as evidenced by the error occurring with `String[].class`. The method `getPackageName` correctly handles `null` inputs, which suggests that the issue is more likely related to array handling in `getShortClassName`, rather than a recent change affecting null or primitive types."
org.apache.commons.lang.ClassUtils.getPackageName(String),0.200000,H1,0.700000,"Hypothesis H1: The failure may be caused by recent changes in the `ClassUtils` class that altered the behavior of the `getShortClassName` method, leading to unexpected results in the test.",org.apache.commons.lang.ClassUtils (HH1),"The method `org.apache.commons.lang.ClassUtils.getPackageName(String)` does not directly support or contradict Hypothesis H1, as it deals with extracting package names from class names, not with shortening class names. However, if recent changes in `ClassUtils` affected how class names are parsed or handled, it could indirectly impact both `getShortClassName` and `getPackageName` methods. The failure in `getShortClassName` suggests a possible change in handling array types, which might not directly relate to `getPackageName`, unless similar parsing logic is shared or altered in both methods."
