method,score,hypothesis_id,hypothesis_confidence,hypothesis_text,class_match,hypothesis_explanation
"org.apache.commons.math3.ode.nonstiff.EmbeddedRungeKuttaIntegrator.integrate(ExpandableStatefulODE,double)",0.710000,H2,0.700000,"Hypothesis H2: The failure might be caused by incorrect handling of event state transitions within the DormandPrince853Integrator, leading to missed or improperly scheduled events during integration.",org.apache.commons.math3.ode.nonstiff.EmbeddedRungeKuttaIntegrator (HH4),"The method `integrate` in `EmbeddedRungeKuttaIntegrator` is responsible for advancing the solution of differential equations while handling events. If the method incorrectly manages event state transitions, it could lead to missed or improperly scheduled events, supporting Hypothesis H2. The stack trace indicates that the failure occurs during event evaluation (`EventState.evaluateStep`), suggesting that the integration process might not be correctly detecting or handling the event transitions defined by `SchedulingChecker`. This aligns with H2, as improper event handling during integration could cause the observed test failure."
"org.apache.commons.math3.ode.nonstiff.EmbeddedRungeKuttaIntegrator.EmbeddedRungeKuttaIntegrator(String,boolean,double[],double[][],double[],RungeKuttaStepInterpolator,double,double,double,double)",0.708947,H4,0.700000,"Hypothesis H4: The failure may be caused by incorrect handling of floating-point precision errors during the integration process, leading to inaccurate event detection and scheduling.",org.apache.commons.math3.ode.nonstiff.EmbeddedRungeKuttaIntegrator (HH4),"The method `EmbeddedRungeKuttaIntegrator` initializes the integrator with specific parameters, including arrays for Butcher tableau coefficients and control parameters for numerical stability and error control. This setup is crucial for managing floating-point precision during integration. If these parameters, such as safety, minimal reduction, and maximal growth, are not appropriately configured, it could lead to precision errors, supporting hypothesis H4. The method's role in setting these parameters suggests that incorrect handling or configuration could indeed result in inaccurate event detection and scheduling, as hypothesized."
org.apache.commons.math3.ode.nonstiff.EmbeddedRungeKuttaIntegrator.setSafety(double),0.300000,H3,0.700000,"Hypothesis H3: The failure might be caused by a misconfiguration in the event handler's tolerance settings, leading to incorrect event detection or scheduling during the integration process.",org.apache.commons.math3.ode.nonstiff.EmbeddedRungeKuttaIntegrator (HH4),"The method `setSafety(double)` adjusts the safety factor for stepsize control, which influences the integration process's stability and accuracy. However, it does not directly affect the event handler's tolerance settings. Since the method only modifies the internal `safety` field without interacting with event detection mechanisms, it neither supports nor contradicts Hypothesis H3 regarding misconfiguration in event handler tolerances. The failure is more likely related to event handler settings rather than the stepsize safety factor."
org.apache.commons.math3.ode.nonstiff.EmbeddedRungeKuttaIntegrator.setMaxGrowth(double),0.200000,H1,0.700000,"H1: The failure in ""testEventsScheduling"" could be due to a misconfiguration in the event handler's tolerance settings, causing it to inaccurately detect or miss event occurrences during integration.",org.apache.commons.math3.ode.nonstiff.EmbeddedRungeKuttaIntegrator (HH4),"The method `setMaxGrowth(double)` adjusts the maximal growth factor for step size control in the integration process. This setting influences how the step size can increase between integration steps, potentially affecting the precision of event detection. If the `maxGrowth` is set too high, it could lead to larger step sizes that skip over events, supporting hypothesis H1. However, since the method does not directly interact with event handler tolerance settings, it does not directly contradict H1 but suggests that step size control might indirectly impact event detection accuracy."
org.apache.commons.math3.ode.nonstiff.EmbeddedRungeKuttaIntegrator.setMinReduction(double),0.200000,H1,0.700000,"H1: The failure in ""testEventsScheduling"" could be due to a misconfiguration in the event handler's tolerance settings, causing it to inaccurately detect or miss event occurrences during integration.",org.apache.commons.math3.ode.nonstiff.EmbeddedRungeKuttaIntegrator (HH4),"The method `setMinReduction(double)` in `EmbeddedRungeKuttaIntegrator` adjusts the minimal reduction factor for step size control, which influences how the integrator adapts its step size during the integration process. This setting does not directly affect the event handler's tolerance settings, which are responsible for detecting events. Therefore, the hypothesis H1 is not supported by this method, as it does not interact with or configure the event handler's tolerance settings that could lead to missed or inaccurately detected events."
